"_id","_labels","poi_created_at","poi_description","poi_images","poi_location","poi_name","_start","_end","_type"
"9726",":PointOfInterest","2025-01-24T16:57:41.253Z","[""Управление Ботанического института им. В. Л. Комарова""]","[""https://p0.citywalls.ru/thumb0_50-51904.jpg?mt=1281867938"",""https://p2.citywalls.ru/thumb_336-344206.jpg?mt=1524157691"",""https://p1.citywalls.ru/thumb_50-51905.jpg?mt=1281867938"",""https://p1.citywalls.ru/thumb_121-124681.jpg?mt=1336586269"",""https://p2.citywalls.ru/thumb_121-124682.jpg?mt=1336586282""]","{""crs"":""wgs-84"",""latitude"":59.9704,""longitude"":30.3194,""height"":null}","Ботанический институт им. В.Л. Комарова . Жилой дом для рабочих и сотрудников",,,
"9727",":PointOfInterest","2025-01-24T16:57:41.253Z","[""* Здание авторемонтного завода ленинградского коммунального транспорта (на втором плане справа - Производственное здание бывшей "",""    багетной фабрики Н. А. Фрейдберга). До мировой войны в здании АРЗ помещалась багетная фабрика частного владельца, который в 1915 г. "",""    продал весь участок с застройками, где и были организованы авторемонтные мастерские, которые после Октябрьской революции перешли в "",""    ведение Ленинградского Исполкома... - Журнал Мотор, 1935, №3, с. 6  "",""**  На схеме: 1 корпус – пр. Медиков, 5, лит А; 2 корпус -  наб. р. Карповки, 5, лит. – здание котельной;  3 корпус - наб. р. Карповки, 5, кор. 3  лит. Е"",""                      6 корпус – пр. Медиков, 5 лит. В;               7 корпус -  наб. р. Карповки, 5, лит. Г;       11 корпус -  наб. р. Карповки, 5, лит. Р;    "",""                      12 корпус -  наб. р. Карповки, 5, лит. Б;     14 корпус -  наб. р. Карповки, 5, лит. И;    15 корпус -  Аптекарский пр., 2,  лит. З;"",""                      16 корпус -  наб. р. Карповки, 5, кор. 16;   17 корпус -  наб. р. Карповки, 5, кор. 17;  19 корпус – пр. Медиков, 7;"",""                      20 корпус -  наб. р. Карповки, 5,  кор. 20;   21 корпус -  наб. р. Карповки, 7,  лит. А;   22 корпус -  наб. р. Карповки,5  кор. 22,  лит. А;"",""                      25 корпус -  наб. р. Карповки, 5, лит. М;     26 корпус -  наб. р. Карповки, 5, лит. С;    27 корпус -  наб. р. Карповки, 5, лит. П;"",""                      28 корпус -  наб. р. Карповки, 5, лит. Л;      33 корпус - наб. р. Карповки, 5,  кор. 33.""]","[""https://p3.citywalls.ru/thumb0_50-51639.jpg?mt=1281677005"",""https://p3.citywalls.ru/thumb_558-571439.jpg?mt=1656765683"",""https://p0.citywalls.ru/thumb_558-571440.jpg?mt=1656765689"",""https://p2.citywalls.ru/thumb_558-571438.jpg?mt=1656765674"",""https://p1.citywalls.ru/thumb_415-425369.jpg?mt=1577714004""]","{""crs"":""wgs-84"",""latitude"":59.969,""longitude"":30.3181,""height"":null}","Производственные здания фабрики Н. А. Фрейдберга",,,
"9728",":PointOfInterest","2025-01-24T16:57:41.253Z","[""Исторически улица Литераторов и набережная Карповки это одно и то же. В XIX в. линия застройки по Карповке, от Аптекарского проспекта по территорию современного дома 19 (по Карповке) включительно, проходила по линии, по которой сейчас проходит улица Литераторов. Между этой линией и собственно берегом не было участков, там ничего не строили, так же, как не строили первоначально на аналогичном пространстве на набережной Малой Невки на Каменном острове, например. "",""Застройка пространства между линией набережной (домов по ней) и берегом началась ближе к концу XIX в. Так образовался проезд, который позднее и получил название улица Литераторов, но формально, в документах, в адресных книгах, эта улица появилась только в XX в. Вот на карте 1904 г. все это хорошо видно."",""Поэтому угловой участок 2 по Аптекарскому проспекту до Формального признания улицы Литераторов имел адрес: Аптекарский пр., 2 - наб. Карповки, 3. А когда появился на самом берегу дом Здравия, он получил номер 2а по Аптекарскому проспекту."",""На этой фотографии дом с адресом Аптекарский пр., 2 - наб. Карповки, 3, а дом Здравия, который не имел к нему никакого отношения, а имел № 2а по Аптекарскому проспекту, находился за тем забором, который ближе к левому краю фотографии. Проулок, получившийся между ними, это начало будущей улицы Литераторов. Деревянный дом № 2-3 при советах превратился в то, что мы видим на фото 2, на его месте  позднее построили здание, которое мы видим на титульном фото. "",""Правее деревянного дома на фото 1903 г. стоит одноэтажное кирпичное здание фабрики, принадлежавшее к этому же участку № 2-3. Позднее оно было перестроено и надстроено и превратилось в то промышленное здание, которое мы видим на фото справа от деревянного и в натуре. "",""Адресная книга на 1896 г. показывает владельцем участка купца 2 гильдии Игнатия Игнатьевича Дюфо (О. I. Стб. 20). В купеческой книге 1898 г. он - Дюфо Игнатий-Александр, 57 лет, французский гражданнин, католик, платит гильдейсские повинности с 1872 г. Жительствует по М. Конюшенной улице, 9 Содержит магазин ковров и мебельных материй в доме жительства и фабрику по Аптекарскому пр.. соб. д. № 2 (С. 276)."",""Несколько, совсем немного, лет в начале 1900-х домом владел Гаральд Германович Бюхтгер, классный художник-архитектор, сын того Бюхтгера, который жил и держал мебельную мастерскую на Английском пр., 8. К этому времени относятся фотографии дома, одна из которых приведена. Он занимался здесь производством ковров и мебельных материй."",""Других записей у себя что-то не вижу, но следующим владельцем фабрики был Нахман Шлемович Фрейдберг., выпускавший здесь багеты и рамки. Это конец 1900-х - начало 1910-х. К этому времени относится перестройка производственного корпуса.                                                                                                                          (Добавил: Liz)"",""АТУЛ расшифровывается как Автотранспортное управление Ленсовета. При управлении существовал 2-й авторемонтный завод, который изначально занимался только ремонтом, с 1925 г. начал изготовлять автобусные кузова, а после 1932-го разработал несколько полноценных автобусов оригинального дизайна. В качестве шасси использовались различные модели ЗИС, Я, АМО, а также ряд иностранных, в частности, MAN."",""Автобусы АТУЛ изготовлялись малыми партиями и практически все работали в Ленинграде, хотя ряд машин поступили в Москву и Минск. Завод прекратил существование в 1950 г.                                                                       (car-day.ru 23.10.2017)"",""Пристройка к более старому 3-х этажному зданию."",""Этот корпус в период проектирования и строительства был угловым,  на углу Аптекарского пр. и ул. Литераторов."",""Позднее, вероятно, в 1950-х гг., эта часть улицы Литераторов оказалась внутри территории завода."",""Южный фасад цеха был обращен изначально на исчезнувшую улицу."",""Корпус построен на месте деревянного одноэтажного здания и 2-х этажного дома на углу. "",""До 1-й мировой войны на участке размещалась багетная фабрика частного владельца."",""В 1915 он её продал вместе со всеми строениями и там были созданы авторемонтные мастерские."",""С 1927 с началом автобусного движения в Ленинграде здесь был организован ремонт и производство автобусных кузовов. Был создан Авторемонтный завод (АРЗ) транспортного управления Ленинграда. "",""В 2012 бизнес-центр Аптекарский,2 "",""Сделан евроремонт, Телефония, Круглосуточная охрана, Кондиционирование, Видеонаблюдение, Пожарная сигнализация, пол ламинат, окна металлопластиковые, планировка коридорная, отделка Бизнес класса, Историческое здание, Кафе, Оштукатуренный фасад "",""(Инф. сайтов Бизнес центры двух столиц business-centres.ru  и Море офисов more-ofisov.ru  26.01.2013)"",""1935: Авторемонтный завод АРЗ. Аптекарский пр.. 2. В ведении Транспортного управления Ленсовета. "",""         Производство: капитальный ремонт автобусов. Директор Романов В. Д."",""         Кузовной отдел - ул. 3-го июля, 50-б   (ВЛ на 1935)"",""1937, 1940: Авторемонтный завод Автотранспортного управления Ленсовета. Аптекарский пр.. 2. "",""       Кузовной отдел - ул. 3-го июля, 50-б   (ВЛ на 1937; Список абонентов ЛГТС. 1940)""]","[""https://p0.citywalls.ru/thumb0_148-152524.jpg?mt=1360156523"",""https://p2.citywalls.ru/thumb_390-399754.jpg?mt=1560979601"",""https://p3.citywalls.ru/thumb_280-287139.jpg?mt=1497649693"",""https://p1.citywalls.ru/thumb_148-151553.jpg?mt=1359187870"",""https://p2.citywalls.ru/thumb_148-151554.jpg?mt=1359187870""]","{""crs"":""wgs-84"",""latitude"":59.9687,""longitude"":30.3173,""height"":null}","Производственное здание - БЦ ""Аптекарский, 2""",,,
"9729",":PointOfInterest","2025-01-24T16:57:41.253Z","[""Началом жизни завода следует считать 1890 г., когда в реестре столичных предприятий впервые упоминается завод табачных машин, основанный инженером И. А. Семеновым."",""Уже в 1896 г. на выставке в Нижнем Новгороде изделие машиностроительного завода Семенова получает серебряную медаль."",""А в 1900 г. на Всемирной Парижской выставке  - высшую награду - GRAND PRIX. В 1922 г. восстановленному предприятию присвоено имя Государственный завод точного машиностроения имени Макса Гельца."",""С 1945 г. предприятие называется - Ленинградский завод полиграфических машин. В 1991г. завод становится акционерным обществом."",""1988: Производственное объединение Ленполиграфмаш, наб. р. Карповки, 5. ([125] C. 314)"",""          Медсанчасть № 62 объединения Ленполиграфмаш.  ([125]. C. 281)"",""2004: ОАО «Ленполиграфмаш» (ассортимент: пластмассовые изделия, оборудование пищевой промышленности, оборудование "",""            полиграфическое и типографское, печатные платы) - наб. реки Карповки, 5   "",""         «Ленполиграфмаш» торговый дом ООО «Ленполиграфмаш» - наб. реки Карповки, 5 +11 контор-арендаторов "",""(Телефонный справочник «Весь Петербург-2004») "",""Здание включено в список вновь выявленных объектов, представляющих культурную ценность.""]","[""https://p1.citywalls.ru/thumb0_8-8329.jpg?mt=1273625807"",""https://p2.citywalls.ru/thumb_442-453302.jpg?mt=1595511203"",""https://p0.citywalls.ru/thumb_447-458700.jpg?mt=1598809741"",""https://p3.citywalls.ru/thumb_489-500851.jpg?mt=1619626770"",""https://p1.citywalls.ru/thumb_50-51445.jpg?mt=1281254776""]","{""crs"":""wgs-84"",""latitude"":59.9682,""longitude"":30.3165,""height"":null}","Доходный дом - Детский дом N 4 - Завод ""Полиграфмаш"" . Проходная",,,
